{
  "artifactType": "MEDIA_PLAN",
  "compilerVersion": "0.2.0",
  "targetMedia": "WEBTOON",
  "source": {
    "universeId": "universe:lantern-below",
    "universeVersion": "0.5.0",
    "storyId": "story:first-light",
    "manifestId": "media:first-light-webtoon"
  },
  "output": {
    "kind": "WEBTOON_PLAN",
    "readingDirection": "VERTICAL_SCROLL",
    "episodes": [
      {
        "id": "episode:1",
        "sequences": [
          {
            "id": "scroll-sequence:1",
            "sceneId": "scene:discovery",
            "panels": [
              {
                "id": "scroll-sequence:1:panel:1",
                "revealOrder": 1,
                "source": {
                  "eventId": "event:001",
                  "eventType": "DISCOVERY",
                  "participants": [
                    "entity:lia",
                    "entity:leo"
                  ],
                  "locationId": "entity:house"
                }
              },
              {
                "id": "scroll-sequence:1:panel:2",
                "revealOrder": 2,
                "source": {
                  "eventId": "event:002",
                  "eventType": "ACTIVATION",
                  "participants": [
                    "entity:lia",
                    "entity:leo"
                  ],
                  "locationId": "entity:house"
                }
              }
            ]
          },
          {
            "id": "scroll-sequence:2",
            "sceneId": "scene:investigation",
            "panels": [
              {
                "id": "scroll-sequence:2:panel:1",
                "revealOrder": 1,
                "source": {
                  "eventId": "event:003",
                  "eventType": "INSPECTION",
                  "participants": [
                    "entity:lia"
                  ],
                  "locationId": "entity:house"
                }
              },
              {
                "id": "scroll-sequence:2:panel:2",
                "revealOrder": 2,
                "source": {
                  "eventId": "event:004",
                  "eventType": "REACTION_TEST",
                  "participants": [
                    "entity:leo"
                  ],
                  "locationId": "entity:house"
                }
              },
              {
                "id": "scroll-sequence:2:panel:3",
                "revealOrder": 3,
                "source": {
                  "eventId": "event:005",
                  "eventType": "SIBLING_CONFLICT",
                  "participants": [
                    "entity:lia",
                    "entity:leo"
                  ],
                  "locationId": "entity:house"
                }
              }
            ]
          },
          {
            "id": "scroll-sequence:3",
            "sceneId": "scene:opening",
            "panels": [
              {
                "id": "scroll-sequence:3:panel:1",
                "revealOrder": 1,
                "source": {
                  "eventId": "event:006",
                  "eventType": "PASSAGE_REVEAL",
                  "participants": [
                    "entity:lia",
                    "entity:leo"
                  ],
                  "locationId": "entity:house"
                }
              },
              {
                "id": "scroll-sequence:3:panel:2",
                "revealOrder": 2,
                "source": {
                  "eventId": "event:007",
                  "eventType": "DECISION",
                  "participants": [
                    "entity:lia",
                    "entity:leo"
                  ],
                  "locationId": "entity:house"
                }
              }
            ]
          },
          {
            "id": "scroll-sequence:4",
            "sceneId": "scene:mark",
            "panels": [
              {
                "id": "scroll-sequence:4:panel:1",
                "revealOrder": 1,
                "source": {
                  "eventId": "event:008",
                  "eventType": "CLUE_DISCOVERY",
                  "participants": [
                    "entity:lia",
                    "entity:leo"
                  ],
                  "locationId": "entity:tunnel"
                }
              },
              {
                "id": "scroll-sequence:4:panel:2",
                "revealOrder": 2,
                "source": {
                  "eventId": "event:009a",
                  "eventType": "BRANCH_DESCEND_TOGETHER",
                  "participants": [
                    "entity:lia",
                    "entity:leo"
                  ],
                  "locationId": "entity:tunnel"
                }
              },
              {
                "id": "scroll-sequence:4:panel:3",
                "revealOrder": 3,
                "source": {
                  "eventId": "event:009b",
                  "eventType": "BRANCH_SEAL_AND_RETURN",
                  "participants": [
                    "entity:lia",
                    "entity:leo"
                  ],
                  "locationId": "entity:tunnel"
                }
              }
            ]
          }
        ]
      }
    ]
  },
  "traceability": [
    {
      "unitId": "scroll-sequence:1:panel:1",
      "eventIds": [
        "event:001"
      ],
      "sceneId": "scene:discovery"
    },
    {
      "unitId": "scroll-sequence:1:panel:2",
      "eventIds": [
        "event:002"
      ],
      "sceneId": "scene:discovery",
      "ruleIds": [
        "rule:lantern-reveals-passage"
      ]
    },
    {
      "unitId": "scroll-sequence:2:panel:1",
      "eventIds": [
        "event:003"
      ],
      "sceneId": "scene:investigation"
    },
    {
      "unitId": "scroll-sequence:2:panel:2",
      "eventIds": [
        "event:004"
      ],
      "sceneId": "scene:investigation",
      "ruleIds": [
        "rule:lantern-reveals-passage"
      ]
    },
    {
      "unitId": "scroll-sequence:2:panel:3",
      "eventIds": [
        "event:005"
      ],
      "sceneId": "scene:investigation"
    },
    {
      "unitId": "scroll-sequence:3:panel:1",
      "eventIds": [
        "event:006"
      ],
      "sceneId": "scene:opening",
      "ruleIds": [
        "rule:lantern-reveals-passage"
      ]
    },
    {
      "unitId": "scroll-sequence:3:panel:2",
      "eventIds": [
        "event:007"
      ],
      "sceneId": "scene:opening"
    },
    {
      "unitId": "scroll-sequence:4:panel:1",
      "eventIds": [
        "event:008"
      ],
      "sceneId": "scene:mark",
      "choiceIds": [
        "choice:after-grandmother-mark"
      ],
      "evidenceIds": [
        "evidence:grandmother-mark"
      ]
    },
    {
      "unitId": "scroll-sequence:4:panel:2",
      "eventIds": [
        "event:009a"
      ],
      "sceneId": "scene:mark"
    },
    {
      "unitId": "scroll-sequence:4:panel:3",
      "eventIds": [
        "event:009b"
      ],
      "sceneId": "scene:mark"
    }
  ],
  "validation": {
    "mappedEventIds": [
      "event:001",
      "event:002",
      "event:003",
      "event:004",
      "event:005",
      "event:006",
      "event:007",
      "event:008",
      "event:009a",
      "event:009b"
    ],
    "storyEventIds": [
      "event:001",
      "event:002",
      "event:003",
      "event:004",
      "event:005",
      "event:006",
      "event:007",
      "event:008",
      "event:009a",
      "event:009b"
    ],
    "unmappedStoryEventIds": []
  }
}
