{
  "artifactType": "MEDIA_PLAN",
  "compilerVersion": "0.1.0",
  "targetMedia": "MANGA",
  "source": {
    "universeId": "universe:lantern-below",
    "universeVersion": "0.3.0",
    "storyId": "story:first-light",
    "manifestId": "media:first-light-manga"
  },
  "output": {
    "kind": "MANGA_PLAN",
    "readingDirection": "RIGHT_TO_LEFT",
    "chapters": [
      {
        "id": "chapter:1",
        "pages": [
          {
            "id": "page:1",
            "sceneId": "scene:discovery",
            "title": "The Chest",
            "panels": [
              {
                "id": "page:1:panel:1",
                "source": {
                  "eventId": "event:001",
                  "eventType": "DISCOVERY",
                  "participants": [
                    "entity:lia",
                    "entity:leo"
                  ],
                  "locationId": "entity:house"
                }
              },
              {
                "id": "page:1:panel:2",
                "source": {
                  "eventId": "event:002",
                  "eventType": "ACTIVATION",
                  "participants": [
                    "entity:lia",
                    "entity:leo"
                  ],
                  "locationId": "entity:house"
                }
              }
            ]
          },
          {
            "id": "page:2",
            "sceneId": "scene:investigation",
            "title": "Two Theories",
            "panels": [
              {
                "id": "page:2:panel:1",
                "source": {
                  "eventId": "event:003",
                  "eventType": "INSPECTION",
                  "participants": [
                    "entity:lia"
                  ],
                  "locationId": "entity:house"
                }
              },
              {
                "id": "page:2:panel:2",
                "source": {
                  "eventId": "event:004",
                  "eventType": "REACTION_TEST",
                  "participants": [
                    "entity:leo"
                  ],
                  "locationId": "entity:house"
                }
              },
              {
                "id": "page:2:panel:3",
                "source": {
                  "eventId": "event:005",
                  "eventType": "SIBLING_CONFLICT",
                  "participants": [
                    "entity:lia",
                    "entity:leo"
                  ],
                  "locationId": "entity:house"
                }
              }
            ]
          },
          {
            "id": "page:3",
            "sceneId": "scene:opening",
            "title": "The Wall Opens",
            "panels": [
              {
                "id": "page:3:panel:1",
                "source": {
                  "eventId": "event:006",
                  "eventType": "PASSAGE_REVEAL",
                  "participants": [
                    "entity:lia",
                    "entity:leo"
                  ],
                  "locationId": "entity:house"
                }
              },
              {
                "id": "page:3:panel:2",
                "source": {
                  "eventId": "event:007",
                  "eventType": "DECISION",
                  "participants": [
                    "entity:lia",
                    "entity:leo"
                  ],
                  "locationId": "entity:house"
                }
              }
            ]
          },
          {
            "id": "page:4",
            "sceneId": "scene:mark",
            "title": "Grandmother's Mark",
            "panels": [
              {
                "id": "page:4:panel:1",
                "source": {
                  "eventId": "event:008",
                  "eventType": "CLUE_DISCOVERY",
                  "participants": [
                    "entity:lia",
                    "entity:leo"
                  ],
                  "locationId": "entity:tunnel"
                }
              },
              {
                "id": "page:4:panel:2",
                "source": {
                  "eventId": "event:009a",
                  "eventType": "BRANCH_DESCEND_TOGETHER",
                  "participants": [
                    "entity:lia",
                    "entity:leo"
                  ],
                  "locationId": "entity:tunnel"
                }
              },
              {
                "id": "page:4:panel:3",
                "source": {
                  "eventId": "event:009b",
                  "eventType": "BRANCH_SEAL_AND_RETURN",
                  "participants": [
                    "entity:lia",
                    "entity:leo"
                  ],
                  "locationId": "entity:tunnel"
                }
              }
            ]
          }
        ]
      }
    ]
  },
  "traceability": [
    {
      "unitId": "page:1:panel:1",
      "eventIds": [
        "event:001"
      ],
      "sceneId": "scene:discovery"
    },
    {
      "unitId": "page:1:panel:2",
      "eventIds": [
        "event:002"
      ],
      "sceneId": "scene:discovery"
    },
    {
      "unitId": "page:2:panel:1",
      "eventIds": [
        "event:003"
      ],
      "sceneId": "scene:investigation"
    },
    {
      "unitId": "page:2:panel:2",
      "eventIds": [
        "event:004"
      ],
      "sceneId": "scene:investigation"
    },
    {
      "unitId": "page:2:panel:3",
      "eventIds": [
        "event:005"
      ],
      "sceneId": "scene:investigation"
    },
    {
      "unitId": "page:3:panel:1",
      "eventIds": [
        "event:006"
      ],
      "sceneId": "scene:opening"
    },
    {
      "unitId": "page:3:panel:2",
      "eventIds": [
        "event:007"
      ],
      "sceneId": "scene:opening"
    },
    {
      "unitId": "page:4:panel:1",
      "eventIds": [
        "event:008"
      ],
      "sceneId": "scene:mark"
    },
    {
      "unitId": "page:4:panel:2",
      "eventIds": [
        "event:009a"
      ],
      "sceneId": "scene:mark"
    },
    {
      "unitId": "page:4:panel:3",
      "eventIds": [
        "event:009b"
      ],
      "sceneId": "scene:mark"
    }
  ],
  "validation": {
    "mappedEventIds": [
      "event:001",
      "event:002",
      "event:003",
      "event:004",
      "event:005",
      "event:006",
      "event:007",
      "event:008",
      "event:009a",
      "event:009b"
    ],
    "storyEventIds": [
      "event:001",
      "event:002",
      "event:003",
      "event:004",
      "event:005",
      "event:006",
      "event:007",
      "event:008",
      "event:009a",
      "event:009b"
    ],
    "unmappedStoryEventIds": []
  }
}
